"","No","Nama Perusahaan","Merek Dagang","Kantor Pusat","Opsi","link"
"1",1,"PT. Abdi Ummat Wisata International","ATTIN TOUR","Jl. Lap. Tembak No. 39, Ciracas, Jakarta Timur, DKI Jakarta, 13720",NA,"https://himpuh.or.id/daftar-anggota/detail/3/pt-abdi-ummat-wisata-international"
"2",2,"PT. Adzikra","PT. Adzikra","Pusat Niaga Duta Mas Fatmawati Blok C 2 No. 11-12, Jl. Fatmawati Raya No. 39, Kebayoran Baru, Jakarta Selatan, DKI Jakarta, 12150",NA,"https://himpuh.or.id/daftar-anggota/detail/4/pt-adzikra"
"3",3,"PT. Aero Globe Indonesia","AEROHAJJ","Jl. Prajurit Kko Usman & Harun No. 32, Senen, Senen, Jakarta Pusat, DKI Jakarta, 10410",NA,"https://himpuh.or.id/daftar-anggota/detail/91/pt-aero-globe-indonesia"
"4",4,"PT. Aida Tourindo Wisata","AIDA TOURINDO WISATA","Jl. Cempaka Putih Tengah No. 33, Cempaka Putih, Jakarta Pusat, DKI Jakarta, 10510",NA,"https://himpuh.or.id/daftar-anggota/detail/1/pt-aida-tourindo-wisata"
"5",5,"PT. Al Ahram Sarana Wisata","AL AHRAM","Jl. Tebet Barat Ix No. 11, Tebet, Jakarta Selatan, DKI Jakarta, 12810",NA,"https://himpuh.or.id/daftar-anggota/detail/5/pt-al-ahram-sarana-wisata"
"6",6,"PT. Al Amanah","Al Amanah","Ruko Grand Flower A8 , Jl. Pasar Kembang No.4-6, Sawahan, Surabaya, Jawa Timur, -",NA,"https://himpuh.or.id/daftar-anggota/detail/355/pt-al-amanah"
"7",7,"PT. Al Amin Ahsan Travel","Alisan Tour & Travel","Graha Alisan, Jl. Asem Baris Raya No. 126/3, Kebon Baru, Tebet, Tebet, Jakarta Selatan, DKI Jakarta, 12830",NA,"https://himpuh.or.id/daftar-anggota/detail/195/pt-al-amin-ahsan-travel"
"8",8,"PT. Al Amin Mulia Lestari","DAQU TOUR & TRAVEL","Cbd Ciledug Blok A5 No. 21, Karang Tengah, Tangerang, Banten, 15157",NA,"https://himpuh.or.id/daftar-anggota/detail/2/pt-al-amin-mulia-lestari"
"9",9,"PT. Al Amsor Mubarokah","AMSOR TOUR","Jl. Duren Tiga Raya No. 101 Kav.a2, Cilandak, Jakarta Selatan, DKI Jakarta, 12760",NA,"https://himpuh.or.id/daftar-anggota/detail/145/pt-al-amsor-mubarokah"
"10",10,"PT. Al Fatihah Tour & Travel","AL-FATIHAH","Jl. Kalpataru 83 A, Lowokwaru, Malang, Jawa Timur, 65141",NA,"https://himpuh.or.id/daftar-anggota/detail/191/pt-al-fatihah-tour-travel"
"11",11,"PT. Al Haadi Ziarah Ampel","AZAM Tour & Travel","Rukan Rose Garden Galaxy City Jl. Rose Garden No. 69, Bekasi Selatan, Bekasi, Jawa Barat, 17147",NA,"https://himpuh.or.id/daftar-anggota/detail/331/pt-al-haadi-ziarah-ampel"
"12",12,"PT. Al Jamarat","PT. Al Jamatour","Jl. Siliwangi No. 63, Coblong, Bandung, Jawa Barat, 0",NA,"https://himpuh.or.id/daftar-anggota/detail/341/pt-al-jamarat"
"13",13,"PT. Al Jazirah Indonesia","JAZIRAH","Jl. Bintara Raya No. 1b, Babelan, Bekasi, Jawa Barat, 17134",NA,"https://himpuh.or.id/daftar-anggota/detail/259/pt-al-jazirah-indonesia"
"14",14,"PT. Al Madinah Citra International","AL MADINAH ACI TOUR & TRAVEL","City Of Tomorrow Mall Blok Gs.9/16 Jl. Ahmad Yani 288, Gayungan, Surabaya, Jawa Timur, 60234",NA,"https://himpuh.or.id/daftar-anggota/detail/94/pt-al-madinah-citra-international"
"15",15,"PT. Al Marhamah Cahaya Utama","ALMARHAMAH","Mt. Haryono Square Of 01/09, Jl. Otista Raya No. 390, Jatinegara, Jakarta Timur, DKI Jakarta, 13330",NA,"https://himpuh.or.id/daftar-anggota/detail/252/pt-al-marhamah-cahaya-utama"
"16",16,"PT. Al-Mahdar Tour","PT. AL-MAHDAR TRAVEL & TOURS","Jl. R.e. Martadinata Komp. Ruko Blok B, No. 5, Anjongan, Pontianak, Kalimantan Barat, 78113",NA,"https://himpuh.or.id/daftar-anggota/detail/6/pt-al-mahdar-tour"
"17",17,"PT. Al-shafwah Wisata Mandiri","AL-SHAFWAH WISATA MANDIRI","Gedung Selmis 2/12 Jl. Asem Baris Raya No. 52 Rt. 001/005, Tebet, Jakarta Selatan, DKI Jakarta, 12830",NA,"https://himpuh.or.id/daftar-anggota/detail/275/pt-al-shafwah-wisata-mandiri"
"18",18,"PT. Al-taif Saudi Wisata","AL TAIF TOUR","Jl. Dr. Saharjo Barkah No. 21b, Tebet, Jakarta Selatan, DKI Jakarta, 12860",NA,"https://himpuh.or.id/daftar-anggota/detail/147/pt-al-taif-saudi-wisata"
"19",19,"PT. Albadriyah Wisata","PT. ALBADRIYAH WISATA","Vinilon Building Jl. Raden Saleh No. 13-17 Cikini - Jakarta Pusat, Kenari, Senen, Senen, Jakarta Pusat, DKI Jakarta, 10430",NA,"https://himpuh.or.id/daftar-anggota/detail/93/pt-albadriyah-wisata"
"20",20,"PT. Alfalah Tours & Travel","ALFALAH TOURS & TRAVEL","Jl. Alfalah / Stm No. 12a, Medan Johor, Medan, Sumatera Utara, 20146",NA,"https://himpuh.or.id/daftar-anggota/detail/285/pt-alfalah-tours-travel"
"21",21,"PT. Alfida Tour & Travel","ALFIDA TOUR & TRAVEL","Jl. Dewi Sartika No. 321a, Kramat Jati, Jakarta Timur, DKI Jakarta, 13630",NA,"https://himpuh.or.id/daftar-anggota/detail/8/pt-alfida-tour-travel"
"22",22,"PT. Alfir Wisata Utama","ALFIR TOUR & TRAVEL","Jl. Taman Mahkam Pahlawan Kalibata No. 1, Pancoran, Jakarta Selatan, DKI Jakarta, 12760",NA,"https://himpuh.or.id/daftar-anggota/detail/148/pt-alfir-wisata-utama"
"23",23,"PT. Alhijaz Indowisata","PT. AL HIJAZ TOUR & TRAVEL (AIW)","Graha Alhijaz Lt. 3. Jl. Dewi Sartika,no.239 A, Kramat Jati, Jakarta Timur, DKI Jakarta, 13630",NA,"https://himpuh.or.id/daftar-anggota/detail/9/pt-alhijaz-indowisata"
"24",24,"PT. Alhijrah Mulia Wisata","AL-HIJRAH TOUR & TRAVEL","Gd. Utaka 66, Lantai 1, Ruang 101,  Jl. Utan Kayu Raya No. 66 B, Matraman, Jakarta Timur, DKI Jakarta, 13220",NA,"https://himpuh.or.id/daftar-anggota/detail/96/pt-alhijrah-mulia-wisata"
"25",25,"PT. Aliston Buana Wisata","Aliston Umroh","Perum Deltasari Indah Blok Ag No. 19 Kureksi, Sidoarjo, Waru, Sidoarjo, Jawa Timur, 61256",NA,"https://himpuh.or.id/daftar-anggota/detail/286/pt-aliston-buana-wisata"
"26",26,"PT. Alkhalid Jaya Megah","JAYA MEGAH TOUR","Jl. Panglima Polim Raya No. 21c, Kebayoran Baru, Jakarta Selatan, DKI Jakarta, 12160",NA,"https://himpuh.or.id/daftar-anggota/detail/198/pt-alkhalid-jaya-megah"
"27",27,"PT. Alqursi Wisata","ALQURSI WISATA","Jl. Jingga Menak No. 15 Kota Baru Parayangan, Padalarang, Bandung Barat, Jawa Barat, 40553",NA,"https://himpuh.or.id/daftar-anggota/detail/239/pt-alqursi-wisata"
"28",28,"PT. Alwan Zahira","ALWAN ZAHIRA","Jl. Am. Sangaji No. 2 Rt. 18, Samarinda Ilir, Samarinda, Kalimantan Timur, 75117",NA,"https://himpuh.or.id/daftar-anggota/detail/98/pt-alwan-zahira"
"29",29,"PT. Amanah Bersama Tour & Travel","AB TOUR","Jl. Raya Pabuaran No. 19-a Rt.03 Rw.03, Jati Sampurna, Bekasi, Jawa Barat, 17432",NA,"https://himpuh.or.id/daftar-anggota/detail/343/pt-amanah-bersama-tour-travel"
"30",30,"PT. Amara Tour & Travel","Amara Tours","Jl. Raya Kincan JatiBening II No. 38, Pondok Gede, Bekasi, Jawa Barat, 17412",NA,"https://himpuh.or.id/daftar-anggota/detail/287/pt-amara-tour-travel"
"31",31,"PT. Ambassador Tour & Travel","AMBASSADOR TOUR","Jl. Re. Martadinata No. 62, 78 A-b-c, Cikole, Sukabumi, Jawa Barat, 43111",NA,"https://himpuh.or.id/daftar-anggota/detail/134/pt-ambassador-tour-travel"
"32",32,"PT. An Cipta Wisata","AN CIPTA WISATA","Ruko Grand Centro Bintaro, No. A12, Jl. Kodam Bintaro, Pesanggrahan, Jakarta Selatan, Pesanggrahan, Jakarta Selatan, DKI Jakarta, 12320",NA,"https://himpuh.or.id/daftar-anggota/detail/321/pt-an-cipta-wisata"
"33",33,"PT. An-naba International (An Naba)","AN NABA","Mt. Haryono Square Of 1/9, Jatinegara, Jakarta Timur, DKI Jakarta, 13330",NA,"https://himpuh.or.id/daftar-anggota/detail/10/pt-an-naba-international-an-naba"
"34",34,"PT. Anamona Tour & Travel","PT. ANAMONA TOUR & TRAVEL","Jl. Inspeksi Saluran Kalimalang No. 4d Rt.004/004, Pondok Bambu, Duren Sawit, Jakarta Timur, Duren Sawit, Jakarta Timur, DKI Jakarta, 13430",NA,"https://himpuh.or.id/daftar-anggota/detail/202/pt-anamona-tour-travel"
"35",35,"PT. Ananda Dar Al Haromain","PT. ANANDA DAR AL HAROMAIN","Jl. Andi Djemma No. 63, Rappocini, Makassar, Sulawesi Selatan, 90222",NA,"https://himpuh.or.id/daftar-anggota/detail/240/pt-ananda-dar-al-haromain"
"36",36,"PT. Ananda Nurul Haromain (Anh)","ANANDA NURUL HAROMAIN ( ANH )","Jl. Landak Baru No.63, Rappocini, Makassar, Sulawesi Selatan, 90222",NA,"https://himpuh.or.id/daftar-anggota/detail/12/pt-ananda-nurul-haromain-anh"
"37",37,"PT. Andiarta Wisata","ANDIARTA WISATA","Graha Adpd. Jl. Buncit Raya No. 101, Pasar Minggu, Jakarta Selatan, DKI Jakarta, 12510",NA,"https://himpuh.or.id/daftar-anggota/detail/13/pt-andiarta-wisata"
"38",38,"PT. Anmar Binawisata","ANMAR BINAWISATA","Jl. Ap Pettarani No. 42 D, Panakkukang, Makassar, Sulawesi Selatan, 90232",NA,"https://himpuh.or.id/daftar-anggota/detail/14/pt-anmar-binawisata"
"39",39,"PT. Annatama Purna","PT. ANNATAMA PURNA","Gedung Mt. Haryono Square Lt 1/21, Jl. Otista Raya No. 390, Jatinegara, Jakarta Timur, DKI Jakarta, 13330",NA,"https://himpuh.or.id/daftar-anggota/detail/15/pt-annatama-purna"
"40",40,"PT. Anneeva Mulya Wisata (amw)","AMW","Pondok Modern Tazakka, Jl. Tazakka No. 2, Bandar, Batang, Jawa Tengah, 51254",NA,"https://himpuh.or.id/daftar-anggota/detail/272/pt-anneeva-mulya-wisata-amw"
"41",41,"PT. Annur Maarif","An Nur Maarif","Jl. Ganggawa No. 78, Maritengngae, Sidenreng Rappang/Rapang, Sulawesi Selatan, 90243",NA,"https://himpuh.or.id/daftar-anggota/detail/11/pt-annur-maarif"
"42",42,"PT. Anugerah Citra Mulia","ANUGERAH WISATA","Cervino Village Apartment, Mezzanine Unit C. Jl. Kh. Abdullah Syafe'i Kav.27 Rt.18/01 Casablanca, Tebet, Jakarta Selatan, DKI Jakarta, 12810",NA,"https://himpuh.or.id/daftar-anggota/detail/17/pt-anugerah-citra-mulia"
"43",43,"PT. Anugerah Quba Mandiri","AQM Tour","Jl. S. Parman No. 17 Tanah Fatah, Ratu Agung, Ratu Agung, Bengkulu, Bengkulu, 38224",NA,"https://himpuh.or.id/daftar-anggota/detail/276/pt-anugerah-quba-mandiri"
"44",44,"PT. Anugerah Zarfin Tour & Travel","ANUGERAH ZARFIN TOUR & TRAVEL","Jl. Kol. Burlian Km. 6 No. 4, Alang-Alang Lebar, Palembang, Sumatera Selatan, 30151",NA,"https://himpuh.or.id/daftar-anggota/detail/288/pt-anugerah-zarfin-tour-travel"
"45",45,"PT. Arfina Margi Wisata","AL AZHAR TOUR & TRAVEL","Jl. Ciledug Raya No. 123a, Kebayoran Lama, Jakarta Selatan, DKI Jakarta, 12230",NA,"https://himpuh.or.id/daftar-anggota/detail/99/pt-arfina-margi-wisata"
"46",46,"PT. Arhas Bugis Tour & Travel","ARHAS TRAVEL","Jl. Lingkar Luar Kamal Raya, Mall Taman Palem Ruko 26, Cengkareng, Cengkareng, Jakarta Barat, DKI Jakarta, 11730",NA,"https://himpuh.or.id/daftar-anggota/detail/345/pt-arhas-bugis-tour-travel"
"47",47,"PT. Arie Tour & Travel","ARIE TOUR & TRAVEL","Jl. Chairil Anwar Blok B No. 12, Babelan, Bekasi, Jawa Barat, 17113",NA,"https://himpuh.or.id/daftar-anggota/detail/203/pt-arie-tour-travel"
"48",48,"PT. Armada Safari Suci","SAFARI SUCI","Jl. Taman Ciarum No. 11, Arjasari, Bandung, Jawa Barat, 40115",NA,"https://himpuh.or.id/daftar-anggota/detail/19/pt-armada-safari-suci"
"49",49,"PT. Armina Mabror","PT. ARMINA MABROR","Jl. Imam Bonjol No. 76, Sanan Wetan, Blitar, Jawa Timur, 43228",NA,"https://himpuh.or.id/daftar-anggota/detail/294/pt-armina-mabror"
"50",50,"PT. Arnussaid Tour & Travel","ARNUSSA TOUR","Jl. Bendungan Hilir Iv No. 18, Tanah Abang, Jakarta Pusat, DKI Jakarta, 10210",NA,"https://himpuh.or.id/daftar-anggota/detail/149/pt-arnussaid-tour-travel"
"51",51,"PT. Arrayyan Utama","ARRAYYAN UTAMA","Wisma Bsg Jl. Abdul Muis No. 40, Gambir, Jakarta Pusat, DKI Jakarta, 10160",NA,"https://himpuh.or.id/daftar-anggota/detail/21/pt-arrayyan-utama"
"52",52,"PT. Arrehlah Wisata","ARREHLAH","Jl. Gamelan No. 2 Rt. 034, Palaran, Samarinda, Kalimantan Timur, 75242",NA,"https://himpuh.or.id/daftar-anggota/detail/100/pt-arrehlah-wisata"
"53",53,"PT. Arston Pesona Indonesia","ARSTON TOUR & TRAVEL","Jl.rc. Veteran Raya No. 6, Pesanggrahan, Jakarta Selatan, DKI Jakarta, 12330",NA,"https://himpuh.or.id/daftar-anggota/detail/204/pt-arston-pesona-indonesia"
"54",54,"PT. Arwaniyyah Tour & Travel","ARWANIYYAH TOUR & TRAVEL","Jl. Sunan Kudus No. 237 A Janggalan, Kudus Kota, Kudus, Jawa Tengah, 59315",NA,"https://himpuh.or.id/daftar-anggota/detail/277/pt-arwaniyyah-tour-travel"
"55",55,"PT. As Syifa Prima Jannah","ASY SYIFA","Jl. RM. Hartsono No. 73, Pasar Minggu, Jakarta Selatan, DKI Jakarta, 12550",NA,"https://himpuh.or.id/daftar-anggota/detail/357/pt-as-syifa-prima-jannah"
"56",56,"PT. As-salam Mulya Al-haromain","PT. AS-SALAM MULYA AL-HAROMAIN","Jl. Ciputat Raya No. 4a, Kebayoran Lama, Jakarta Selatan, DKI Jakarta, 12240",NA,"https://himpuh.or.id/daftar-anggota/detail/101/pt-as-salam-mulya-al-haromain"
"57",57,"PT. As-shodiqiyyah Haji & Umrah","AS-SHODIQIYYAH","Jl. Sawah Besar Timur No. 99, Ambarawa, Semarang, Jawa Tengah, 50163",NA,"https://himpuh.or.id/daftar-anggota/detail/278/pt-as-shodiqiyyah-haji-umrah"
"58",58,"PT. As-syirbani Mandiri Wisata (samawa Tour)","SAMAWA TOUR","Jl. Asem Baris Raya No. 8c, Tebet, Jakarta Selatan, DKI Jakarta, 12830",NA,"https://himpuh.or.id/daftar-anggota/detail/150/pt-as-syirbani-mandiri-wisata-samawa-tour"
"59",59,"PT. Asankaloka Riapindo","ASANKALOKA RIAPINDO","Jl. Raya Veteran No. 3d, Arjawinangun, Cirebon, Jawa Barat, 45123",NA,"https://himpuh.or.id/daftar-anggota/detail/271/pt-asankaloka-riapindo"
"60",60,"PT. Asia Utama Wisata","ASIATOUR","Jl. Ciputat Raya No. 4B, Kebayoran Lama, Jakarta Selatan, DKI Jakarta, 12240",NA,"https://himpuh.or.id/daftar-anggota/detail/22/pt-asia-utama-wisata"
"61",61,"PT. Assami Ananda Tours","ANANDA TOUR","Jl. Raya Condet No. 2c Rt.005/003, Kramat Jati, Jakarta Timur, DKI Jakarta, 13530",NA,"https://himpuh.or.id/daftar-anggota/detail/263/pt-assami-ananda-tours"
"62",62,"PT. Asyla Fatimah Wisata","ASYLA TOUR AND TRAVEL","Jl. Gatot Subroto No. 42, Pasar Jambi, Jambi, Jambi, 36123",NA,"https://himpuh.or.id/daftar-anggota/detail/324/pt-asyla-fatimah-wisata"
"63",63,"PT. Attaqwa Garuda Insani","ATTAQWA TOUR","Wijaya Grand Centre Blok E/5, Jl. Wijaya Ii, Kebayoran Baru, Jakarta Selatan, DKI Jakarta, 12160",NA,"https://himpuh.or.id/daftar-anggota/detail/102/pt-attaqwa-garuda-insani"
"64",64,"PT. Attin Tur","Attin Tur","Jl. Raya Hankam No.36 Rt. 007 Rw. 013, Pondok Melati, Bekasi, Jawa Barat, 17141",NA,"https://himpuh.or.id/daftar-anggota/detail/358/pt-attin-tur"
"65",65,"PT. Avianca Muliatama","AMANAH MULIA UMRAH & HAJJ SERVICE","Jl. Jend. Basuki Rahmat No. 25, Jatinegara, Jakarta Timur, DKI Jakarta, 13410",NA,"https://himpuh.or.id/daftar-anggota/detail/103/pt-avianca-muliatama"
"66",66,"PT. Awana Tours & Travel","AWANA TRAVEL","Jl. Pelita No. 2-g, Kebayoran Lama, Jakarta Selatan, DKI Jakarta, 12240",NA,"https://himpuh.or.id/daftar-anggota/detail/104/pt-awana-tours-travel"
"67",67,"PT. Bahtera Nurani Pratama (Nurani Tour & Travel)","NURANI TOUR & TRAVEL","Jl. Depati Hamzah Rt.009/002, Bukit Intan, Pangkal Pinang, Bangka Belitung, 33147",NA,"https://himpuh.or.id/daftar-anggota/detail/105/pt-bahtera-nurani-pratama-nurani-tour-travel"
"68",68,"PT. Balda Citra Mandiri","BALDA HAJI & UMRAH","Jl. Wijaya I No. 8, Kebayoran Baru, Jakarta Selatan, DKI Jakarta, 12170",NA,"https://himpuh.or.id/daftar-anggota/detail/25/pt-balda-citra-mandiri"
"69",69,"PT. Bangun Ummat Sejahtera","BUS TOUR & TRAVEL","Jl. Untung Suropati No. 16 Lasem Rembang Jawa Tengah, Rembang, Rembang, Jawa Tengah",NA,"https://himpuh.or.id/daftar-anggota/detail/356/pt-bangun-ummat-sejahtera"
"70",70,"PT. Baraya Kharisma Jaya","BARAYA TOUR","Jl. Rereng Adumanis No. 6-b, Arjasari, Bandung, Jawa Barat, 40123",NA,"https://himpuh.or.id/daftar-anggota/detail/151/pt-baraya-kharisma-jaya"
"71",71,"PT. Basmah Aryo Wisata (basmah Tour)","BASMAH TOUR","Graha Mas Fatmawati Blok A 31, Kebayoran Baru, Jakarta Selatan, DKI Jakarta, 12150",NA,"https://himpuh.or.id/daftar-anggota/detail/152/pt-basmah-aryo-wisata-basmah-tour"
"72",72,"PT. Batemuri Tour & Travel","Batemuri Tours","Gedung Menara Hijau Lt. 3 Ruang 304, Jl. Mt. Haryono Kav.3, Pancoran, Jakarta Selatan, DKI Jakarta, 12770",NA,"https://himpuh.or.id/daftar-anggota/detail/212/pt-batemuri-tour-travel"
"73",73,"PT. Bayuaji Dunia Wisata","BAYUAJI TOUR","Gedung Wisma Bayuaji Lt. 4 Jl. Gandaria Iii No. 44 Kramat Pela, Kebayoran Baru, Kebayoran Baru, Jakarta Selatan, DKI Jakarta, 12130",NA,"https://himpuh.or.id/daftar-anggota/detail/213/pt-bayuaji-dunia-wisata"
"74",74,"PT. Bimalyndo Hajar Aswad","RIZKIA TOUR & TRAVEL","Jl. Adinegoro No. 15, Koto Tangah, Padang, Sumatera Barat, 25173",NA,"https://himpuh.or.id/daftar-anggota/detail/279/pt-bimalyndo-hajar-aswad"
"75",75,"PT. Bina Cipta Sarana Utama","Bina Umroh","Komplek Surapati Core Kav M-29 Jl. Phh Mustofa No. 39 Rt. 03/10, Arjasari, Bandung, Jawa Barat, 40192",NA,"https://himpuh.or.id/daftar-anggota/detail/334/pt-bina-cipta-sarana-utama"
"76",76,"PT. Bina Kreasi Pesona Selaras","BINA WISATA","Jl. Palbatu Raya No. 6 Casablanca No. 6 Rt. 001/rw. 004, Tebet, Jakarta Selatan, DKI Jakarta, 12810",NA,"https://himpuh.or.id/daftar-anggota/detail/153/pt-bina-kreasi-pesona-selaras"
"77",77,"PT. Biro Perjalanan Umum Dayakindo Kalimantan Utama","DKU","Jl. Panglima Batur, Komp. Citra Niaga Blok A/11, Samarinda Kota, Samarinda, Kalimantan Timur, 75111",NA,"https://himpuh.or.id/daftar-anggota/detail/27/pt-biro-perjalanan-umum-dayakindo-kalimantan-utama"
"78",78,"PT. Biro Perjalanan Wisata Cordova Abila","PT. CORDOVA ABILA Travel","Jl. Kemang Timur Raya No. 48, Mampang Prapatan, Jakarta Selatan, DKI Jakarta, 12730",NA,"https://himpuh.or.id/daftar-anggota/detail/215/pt-biro-perjalanan-wisata-cordova-abila"
"79",79,"PT. Biro Perjalanan Wisata Fattur","PT. FATTUR TOUR & TRAVEL","Jl. Matraman No. 16a, Senen, Jakarta Pusat, DKI Jakarta, 10430",NA,"https://himpuh.or.id/daftar-anggota/detail/33/pt-biro-perjalanan-wisata-fattur"
"80",80,"PT. Biro Perjalanan Wisata Hudaya Safari","HUDAYA SAFARI TRAVEL","Gedung Menara Da'wah, Jl. Kramat Raya No. 45, Senen, Jakarta Pusat, DKI Jakarta, 10450",NA,"https://himpuh.or.id/daftar-anggota/detail/161/pt-biro-perjalanan-wisata-hudaya-safari"
"81",81,"PT. Biro Perjalanan Wisata Neekoi","NEEKOI WISATA","Komp. Ruko Ratna Asri Residence No. 1 Jl. Raya Dr. Ratna, Babelan, Bekasi, Jawa Barat, 17422",NA,"https://himpuh.or.id/daftar-anggota/detail/54/pt-biro-perjalanan-wisata-neekoi"
"82",82,"PT. Biro Perjalanan Wisata Proconfo (Proin)","PROIN TRAVEL","Jl. Rs Fatmawati No. 15 Komplek Golden, Cilandak, Jakarta Selatan, DKI Jakarta, 12420",NA,"https://himpuh.or.id/daftar-anggota/detail/59/pt-biro-perjalanan-wisata-proconfo-proin"
"83",83,"PT. Blang Ponte Tours & Travel","BLANG PONTE TOURS","Gedung Daniprisma Lt.2, Jl. Sultan Hasanuddin No. 47-48, Kebayoran Baru, Jakarta Selatan, DKI Jakarta, 12160",NA,"https://himpuh.or.id/daftar-anggota/detail/219/pt-blang-ponte-tours-travel"
"84",84,"PT. Blocking Ticket Center","Al A'raf Travel","Jl. Buncit Raya No. 10.c Pejaten Pasar Minggu, Pasar Minggu, Jakarta Selatan, DKI Jakarta, 12510",NA,"https://himpuh.or.id/daftar-anggota/detail/221/pt-blocking-ticket-center"
"85",85,"PT. Bobinsa Surabaya Jaya","Bobinsa Tour","Jl. Basuki Rahmat No. 12, Cipinang Muara, Tebet, Jakarta Selatan, DKI Jakarta, 12840",NA,"https://himpuh.or.id/daftar-anggota/detail/359/pt-bobinsa-surabaya-jaya"
"86",86,"PT. Bpw Alhaadi Ziarah Andalas","AZA Tour","Jl. Jenderal Sudirman No. 18 A Rt. 02/vi, Abiansemal, Badung, Bali, 0",NA,"https://himpuh.or.id/daftar-anggota/detail/289/pt-bpw-alhaadi-ziarah-andalas"
"87",87,"PT. BPW Rezki International Indonesia","Simply Travel","Jl. Lingkar Palem Semi Ruko CBD Palem Semi No. 11, Balaraja, Tangerang, Banten, 15139",NA,"https://himpuh.or.id/daftar-anggota/detail/339/pt-bpw-rezki-international-indonesia"
"88",88,"PT. Bpw Riyal Tunggal","RAGATOURS","Jl. A. Yani Km. 4,700 No. 407 Kebun Bunga Banjarmasin Timur, Banjarmasin Tengah, Banjarmasin, Kalimantan Selatan, 70235",NA,"https://himpuh.or.id/daftar-anggota/detail/63/pt-bpw-riyal-tunggal"
"89",89,"PT. Bumi Nata Wisata","BUMI NATA WISATA","Jl. Tukad Pakerisan No. 68, Denpasar Selatan, Denpasar, Bali, 80225",NA,"https://himpuh.or.id/daftar-anggota/detail/291/pt-bumi-nata-wisata"
"90",90,"PT. Cahaya Anugrah Al Mawadah","INTANAYA HAJI UMRAH","Jl. Puri Jambangan Baru Iii No.8, Jambangan, Jambangan, Surabaya, Jawa Timur, 60232",NA,"https://himpuh.or.id/daftar-anggota/detail/274/pt-cahaya-anugrah-al-mawadah"
"91",91,"PT. Cahaya Cordoba Utama","CORMA","Jl. Komplek Surapati Core Blok. Anggrek Boulevard No. 35 Rt. 004/001, Cibeunying Kidul, Bandung, Jawa Barat, 40214",NA,"https://himpuh.or.id/daftar-anggota/detail/335/pt-cahaya-cordoba-utama"
"92",92,"PT. Cahaya Selaras Sejati","CAHAYA SEJATI TOUR","Rukko Sastra Plaza Blok A No. 17, Jl. Gatot Subroto Km 5,4, Balaraja, Tangerang, Banten, 15134",NA,"https://himpuh.or.id/daftar-anggota/detail/303/pt-cahaya-selaras-sejati"
"93",93,"PT. Cakra Mandiri Utama","CAKRA TOUR","Jl. Diponegoro No. 39, Wonokromo, Surabaya, Jawa Timur, 60241",NA,"https://himpuh.or.id/daftar-anggota/detail/155/pt-cakra-mandiri-utama"
"94",94,"PT. Caraka Wisata Tour","CARAKA WISATA","Jl. Jati Baru Raya No. 56a, Gambir, Jakarta Pusat, DKI Jakarta, 10150",NA,"https://himpuh.or.id/daftar-anggota/detail/106/pt-caraka-wisata-tour"
"95",95,"PT. Centig Tour Wisata","CENTIG TOUR","Rasuna office Park unit ZO-07, Setia Budi, Jakarta Selatan, DKI Jakarta, 12940",NA,"https://himpuh.or.id/daftar-anggota/detail/222/pt-centig-tour-wisata"
"96",96,"PT. Ceria Patria Wisata","Ceria Tours","Jl. Cempaka Putih Raya No.25, Cempaka Putih, Jakarta Pusat, DKI Jakarta, 10520",NA,"https://himpuh.or.id/daftar-anggota/detail/107/pt-ceria-patria-wisata"
"97",97,"PT. Chandragama Muda","PT. CHANDRAGAMA MUDA","Jl. Taman Citra Garden 2 Blok H-1/28, Pegadungan, Kalideres, Jakarta Barat, DKI Jakarta, 11830",NA,"https://himpuh.or.id/daftar-anggota/detail/223/pt-chandragama-muda"
"98",98,"PT. Citra Wisata Dunia","CWD TOUR & TRAVEL","Jl. Ipda Tut Harsono No. 3, Umbulharjo, Yogyakarta, DI Yogyakarta, 55165",NA,"https://himpuh.or.id/daftar-anggota/detail/108/pt-citra-wisata-dunia"
"99",99,"PT. Citraceria Usaha Khalifah","KHALIFAH TOUR","Jl. Brigjen Katamso No. 11 Cihaurgeulis, Arjasari, Bandung, Jawa Barat, 40122",NA,"https://himpuh.or.id/daftar-anggota/detail/26/pt-citraceria-usaha-khalifah"
"100",100,"PT. Daehatur Ekspress","Daehatur","Apartemen Cervino Village Gf Blok. H, Jl. Kh. Abdullah Syafei Kav 27, Tebet, Jakarta Selatan, DKI Jakarta, 12810",NA,"https://himpuh.or.id/daftar-anggota/detail/312/pt-daehatur-ekspress"
"101",101,"PT. Dago Wisata Internasional","Dago Wisata","Jl. Puter No. 7, Arjasari, Bandung, Jawa Barat, 40133",NA,"https://himpuh.or.id/daftar-anggota/detail/109/pt-dago-wisata-internasional"
"102",102,"PT. Darul Manasek Internasional","DARUL MANASEK INTERNASIONAL","Ruko Ptc Blok. H8 No. 6 Pulogadung Trade Centre, Jl. Raya Bekasi Km.21, Pulo Gadung, Jakarta Timur, DKI Jakarta, 0",NA,"https://himpuh.or.id/daftar-anggota/detail/300/pt-darul-manasek-internasional"
"103",103,"PT. Dava Tour & Travel","ABHINAYA UMROH","Jl. Minang Kabau No. 29, Setia Budi, Jakarta Selatan, DKI Jakarta, 12970",NA,"https://himpuh.or.id/daftar-anggota/detail/301/pt-dava-tour-travel"
"104",104,"PT. Dawood Andalan Haramain","Dawood Andalan Haramain","Jl. Utama Komplek D'callista No. 1 Rejosari, Tenayan, Tenayan Raya, Pekanbaru, Riau, 28281",NA,"https://himpuh.or.id/daftar-anggota/detail/336/pt-dawood-andalan-haramain"
"105",105,"PT. Dhiyaa El Haramain Mubarokah","ELHARAMAIN WISATA","Ruko Grand Boulevard Asia Tropis Blok At 12-02 Harapan Indah, Abiansemal, Badung, Bali, 0",NA,"https://himpuh.or.id/daftar-anggota/detail/306/pt-dhiyaa-el-haramain-mubarokah"
"106",106,"PT. Dian Nusa Insani","DNI","Jl. Mampang Prapatan Raya No. 69, Mampang Prapatan, Jakarta Selatan, DKI Jakarta, 12790",NA,"https://himpuh.or.id/daftar-anggota/detail/28/pt-dian-nusa-insani"
"107",107,"PT. Dimas Brian Praktis","PRAKTIS","Jl. Raya Surabaya - Malang Km. 36 Bundaran Apolo, Gempol, Pasuruan, Jawa Timur, 67155",NA,"https://himpuh.or.id/daftar-anggota/detail/349/pt-dimas-brian-praktis"
"108",108,"PT. Diyo Siba Tour & Travel","Diyo Siba","Jl. Pacuan Kuda Raya No. 03 Rt. 11/11, Pulo Gadung, Jakarta Timur, DKI Jakarta, 13210",NA,"https://himpuh.or.id/daftar-anggota/detail/185/pt-diyo-siba-tour-travel"
"109",109,"PT. Dua Ribu Wisata","DRW","Jl. Dewi Sartika No. 69 A, Kramat Jati, Jakarta Timur, DKI Jakarta, 13630",NA,"https://himpuh.or.id/daftar-anggota/detail/29/pt-dua-ribu-wisata"
"110",110,"PT. El - Atieq Tour & Travel","El - Atieq","Jl. Kalimalang Raya Blok N/2a Rt. 02/10, Duren Sawit, Jakarta Timur, DKI Jakarta, 13450",NA,"https://himpuh.or.id/daftar-anggota/detail/186/pt-el-atieq-tour-travel"
"111",111,"PT. Elrey Puri Malak","Malak Tour","Jl. MT. Haryono Kav. 22 Signature Park K-01, Tebet, Jakarta Selatan, DKI Jakarta",NA,"https://himpuh.or.id/daftar-anggota/detail/360/pt-elrey-puri-malak"
"112",112,"PT. Fajrul Ikhsan Wisata","ESQ Tour & Travel","Gd. Menara 165 Lt. Dasar Lobby Office, Jl. Tb Simatupang Kav 1 Rt.008/003, Pasar Minggu, Jakarta Selatan, DKI Jakarta, 12650",NA,"https://himpuh.or.id/daftar-anggota/detail/30/pt-fajrul-ikhsan-wisata"
"113",113,"PT. Farafaza Astatama (farfaza)","FARFAZA ASTATAMA TOUR & TRAVEL","Jl. Kramat Jati Ii No. 59, Senen, Jakarta Pusat, DKI Jakarta, 10430",NA,"https://himpuh.or.id/daftar-anggota/detail/156/pt-farafaza-astatama-farfaza"
"114",114,"PT. Farfasa Nurul Qolbi","Farfasa Tour & Travel","Jl. Raya Babat Jombang KM. 02 No. 70, Baureno, Bojonegoro, Jawa Timur, 62192",NA,"https://himpuh.or.id/daftar-anggota/detail/110/pt-farfasa-nurul-qolbi"
"115",115,"PT. Farhan Surya Indah","Farhan Surya Indah Tour & Travel","Jl. Cipinag Jaya Raya Blok. A No. 7, Jatinegara, Jakarta Timur, DKI Jakarta, 13410",NA,"https://himpuh.or.id/daftar-anggota/detail/241/pt-farhan-surya-indah"
"116",116,"PT. Fatahillah Tour Mandiri","FATA TOUR","Sinpasa Commercial Blok. C No. 6 Margamulya Bekasi Utara, Bekasi Utara, Bekasi, Jawa Barat, 17142",NA,"https://himpuh.or.id/daftar-anggota/detail/314/pt-fatahillah-tour-mandiri"
"117",117,"PT. Fath Indah Travel Services","Fath Indah","Jl. Progo No. 5, Wonokromo, Surabaya, Jawa Timur, 60241",NA,"https://himpuh.or.id/daftar-anggota/detail/31/pt-fath-indah-travel-services"
"118",118,"PT. Fazary Wisata","Fazary Wisata","Ruko Prima Bintaro Blok. D, Jl. Wr. Supratman No. 53 Sektor 3 Bintaro Jaya, Ciputat Timur, Tangerang Selatan, Banten, 15412",NA,"https://himpuh.or.id/daftar-anggota/detail/224/pt-fazary-wisata"
